{"schema_version":"3.0","id":"WI-deadbeef-uuid-fb","title":"uuid fb","status":"proposed","review_required":false,"archived_at":null,"priority":"medium","depends_on":[],"source_docs":[],"evidence":{"commit_sha":[],"test_output":null,"files_changed":null,"pr_url":null},"created_at":"2026-05-15T00:00:00Z","updated_at":"2026-05-15T00:00:00Z","owner":null,"notes":"","superseded_by":null,"blocked_reason":null,"last_verified_at":null}
